{"$defs":{"AcquisitionStatusWireV1":{"oneOf":[{"additionalProperties":false,"properties":{"state":{"const":"complete","type":"string"}},"required":["state"],"type":"object"},{"additionalProperties":false,"properties":{"reasons":{"items":{"type":"string"},"type":"array"},"state":{"const":"partial","type":"string"}},"required":["state","reasons"],"type":"object"},{"additionalProperties":false,"properties":{"reason":{"type":"string"},"state":{"const":"unknown","type":"string"}},"required":["state","reason"],"type":"object"}]},"SelectionStatusWireV1":{"oneOf":[{"additionalProperties":false,"properties":{"state":{"const":"passthrough","type":"string"}},"required":["state"],"type":"object"},{"additionalProperties":false,"properties":{"state":{"const":"compiled","type":"string"}},"required":["state"],"type":"object"},{"additionalProperties":false,"properties":{"reason":{"type":"string"},"state":{"const":"needs_more","type":"string"}},"required":["state","reason"],"type":"object"}]}},"$id":"schemas/evidentrail/v1/result_status.schema.json","$schema":"https://json-schema.org/draft/2020-12/schema","additionalProperties":false,"properties":{"acquisition":{"$ref":"#/$defs/AcquisitionStatusWireV1"},"contract":{"const":"evidentrail.result_status","type":"string"},"contract_version":{"const":1,"format":"uint16","maximum":9007199254740991,"minimum":0,"type":"integer"},"pattern_represented":{"format":"uint64","maximum":9007199254740991,"minimum":0,"type":"integer"},"persisted_event_count":{"format":"uint64","maximum":9007199254740991,"minimum":0,"type":"integer"},"presentation_receipt_id":{"pattern":"^prcpt_[0-9a-f]{64}$","type":"string"},"retained_raw":{"format":"uint64","maximum":9007199254740991,"minimum":0,"type":"integer"},"selection":{"$ref":"#/$defs/SelectionStatusWireV1"},"shown_verbatim":{"format":"uint64","maximum":9007199254740991,"minimum":0,"type":"integer"}},"required":["contract","contract_version","acquisition","selection","presentation_receipt_id","persisted_event_count","shown_verbatim","pattern_represented","retained_raw"],"title":"evidentrail.result_status","type":"object"}