{"acquisition":{"state":"complete"},"contract":"evidentrail.result_status","contract_version":1,"pattern_represented":0,"persisted_event_count":0,"presentation_receipt_id":"prcpt_0000000000000000000000000000000000000000000000000000000000000000","retained_raw":0,"selection":{"reason":"question_unsupported","state":"needs_more"},"shown_verbatim":0}